{
  "format": 1,
  "protocol_version": 1,
  "title": "URTC CAN protocol",
  "about": "Machine-readable specification of the CAN bus protocol of the URTC tool head: every identifier with its direction, length rule and payload layout, the magic payloads, the registers of the expansion slave, the version procedures and the SLCAN subset the host tools rely on. All multi-byte fields are big-endian.",
  "byte_order": "big",
  "clients": [
    {
      "key": "firmware",
      "title": "URTC firmware (C)",
      "repository": "URTC"
    },
    {
      "key": "flasher",
      "title": "URTC-FLASHER (Python)",
      "repository": "URTC-FLASHER"
    },
    {
      "key": "tester",
      "title": "URTC-TESTER (Python)",
      "repository": "URTC-TESTER"
    },
    {
      "key": "web_studio",
      "title": "URTC-WEB-STUDIO (TypeScript)",
      "repository": "URTC-WEB-STUDIO"
    }
  ],
  "groups": [
    [
      "impact",
      "Impact register"
    ],
    [
      "global",
      "Global commands"
    ],
    [
      "configuration",
      "Configuration registers"
    ],
    [
      "diagnostics",
      "Diagnostics"
    ],
    [
      "motion",
      "Plain stepper tools"
    ],
    [
      "soldering",
      "Soldering iron"
    ],
    [
      "drill",
      "Drill"
    ],
    [
      "vacuum",
      "Vacuum pickup"
    ],
    [
      "aoi",
      "AOI inspection"
    ],
    [
      "laser",
      "Laser engraver"
    ],
    [
      "printer",
      "3D printer"
    ],
    [
      "electromagnet",
      "Electromagnet"
    ],
    [
      "welding",
      "Spot and ultrasonic welders"
    ],
    [
      "uv",
      "UV curing"
    ],
    [
      "hotair",
      "Hot-air rework"
    ],
    [
      "crimping",
      "Crimping actuator"
    ],
    [
      "slave_bridge",
      "Expansion slave bridge"
    ],
    [
      "pastejetting",
      "Paste jetting"
    ],
    [
      "functionaltest",
      "Functional testing head"
    ],
    [
      "thermal",
      "Thermal inspection"
    ],
    [
      "bootloader",
      "Bootloader and version"
    ]
  ],
  "tools": [
    {
      "id": 0,
      "name": "SOLDERING_IRON",
      "title": "Soldering Iron"
    },
    {
      "id": 1,
      "name": "PASTE_DISPENSER",
      "title": "Paste Dispenser"
    },
    {
      "id": 2,
      "name": "LIQUID_DISPENSER",
      "title": "Liquid Dispenser"
    },
    {
      "id": 3,
      "name": "SCREWDRIVER",
      "title": "Screwdriver"
    },
    {
      "id": 4,
      "name": "VACUUM_PICKUP",
      "title": "Vacuum Pickup"
    },
    {
      "id": 5,
      "name": "DRILL",
      "title": "Drill"
    },
    {
      "id": 6,
      "name": "GRIPPER_GIMBAL",
      "title": "Gripper (Gimbal)"
    },
    {
      "id": 7,
      "name": "GRIPPER_NEMA",
      "title": "Gripper (NEMA)"
    },
    {
      "id": 8,
      "name": "AOI_INSPECTION",
      "title": "AOI Inspection"
    },
    {
      "id": 9,
      "name": "LASER_ENGRAVER",
      "title": "Laser Engraver"
    },
    {
      "id": 10,
      "name": "PRINTER_3D",
      "title": "3D Printer"
    },
    {
      "id": 11,
      "name": "SCAN_PROBE",
      "title": "Scan Probe"
    },
    {
      "id": 12,
      "name": "SMT_PICKPLACE",
      "title": "SMT Pick & Place"
    },
    {
      "id": 13,
      "name": "ELECTROMAGNET",
      "title": "Electromagnet"
    },
    {
      "id": 14,
      "name": "SPOT_WELDER",
      "title": "Spot Welder"
    },
    {
      "id": 15,
      "name": "CONFORMAL_COATING",
      "title": "Conformal Coating"
    },
    {
      "id": 16,
      "name": "VACUUM_GRIPPER_LG",
      "title": "Vacuum Gripper (LG)"
    },
    {
      "id": 17,
      "name": "FLYING_PROBE",
      "title": "Flying Probe"
    },
    {
      "id": 18,
      "name": "UV_CURING",
      "title": "UV Curing"
    },
    {
      "id": 19,
      "name": "HOTAIR_REWORK",
      "title": "Hot Air Rework"
    },
    {
      "id": 20,
      "name": "PRESSFIT_INSERTER",
      "title": "Press-Fit Inserter"
    },
    {
      "id": 21,
      "name": "CRIMPING_ACTUATOR",
      "title": "Crimping Actuator"
    },
    {
      "id": 22,
      "name": "THERMAL_INSPECTION",
      "title": "Thermal Inspection"
    },
    {
      "id": 23,
      "name": "PASTE_JETTING",
      "title": "Paste Jetting"
    },
    {
      "id": 24,
      "name": "ULTRASONIC_WELDER",
      "title": "Ultrasonic Welder"
    },
    {
      "id": 25,
      "name": "INVALID",
      "title": "No tool assigned"
    }
  ],
  "enums": [
    {
      "name": "tool",
      "title": "Tool profile",
      "prefix": "TOOL_",
      "kind": "value",
      "values": [
        {
          "value": 0,
          "name": "SOLDERING_IRON",
          "title": "Soldering Iron"
        },
        {
          "value": 1,
          "name": "PASTE_DISPENSER",
          "title": "Paste Dispenser"
        },
        {
          "value": 2,
          "name": "LIQUID_DISPENSER",
          "title": "Liquid Dispenser"
        },
        {
          "value": 3,
          "name": "SCREWDRIVER",
          "title": "Screwdriver"
        },
        {
          "value": 4,
          "name": "VACUUM_PICKUP",
          "title": "Vacuum Pickup"
        },
        {
          "value": 5,
          "name": "DRILL",
          "title": "Drill"
        },
        {
          "value": 6,
          "name": "GRIPPER_GIMBAL",
          "title": "Gripper (Gimbal)"
        },
        {
          "value": 7,
          "name": "GRIPPER_NEMA",
          "title": "Gripper (NEMA)"
        },
        {
          "value": 8,
          "name": "AOI_INSPECTION",
          "title": "AOI Inspection"
        },
        {
          "value": 9,
          "name": "LASER_ENGRAVER",
          "title": "Laser Engraver"
        },
        {
          "value": 10,
          "name": "PRINTER_3D",
          "title": "3D Printer"
        },
        {
          "value": 11,
          "name": "SCAN_PROBE",
          "title": "Scan Probe"
        },
        {
          "value": 12,
          "name": "SMT_PICKPLACE",
          "title": "SMT Pick & Place"
        },
        {
          "value": 13,
          "name": "ELECTROMAGNET",
          "title": "Electromagnet"
        },
        {
          "value": 14,
          "name": "SPOT_WELDER",
          "title": "Spot Welder"
        },
        {
          "value": 15,
          "name": "CONFORMAL_COATING",
          "title": "Conformal Coating"
        },
        {
          "value": 16,
          "name": "VACUUM_GRIPPER_LG",
          "title": "Vacuum Gripper (LG)"
        },
        {
          "value": 17,
          "name": "FLYING_PROBE",
          "title": "Flying Probe"
        },
        {
          "value": 18,
          "name": "UV_CURING",
          "title": "UV Curing"
        },
        {
          "value": 19,
          "name": "HOTAIR_REWORK",
          "title": "Hot Air Rework"
        },
        {
          "value": 20,
          "name": "PRESSFIT_INSERTER",
          "title": "Press-Fit Inserter"
        },
        {
          "value": 21,
          "name": "CRIMPING_ACTUATOR",
          "title": "Crimping Actuator"
        },
        {
          "value": 22,
          "name": "THERMAL_INSPECTION",
          "title": "Thermal Inspection"
        },
        {
          "value": 23,
          "name": "PASTE_JETTING",
          "title": "Paste Jetting"
        },
        {
          "value": 24,
          "name": "ULTRASONIC_WELDER",
          "title": "Ultrasonic Welder"
        },
        {
          "value": 25,
          "name": "INVALID",
          "title": "No tool assigned"
        }
      ]
    },
    {
      "name": "bootloader_status",
      "title": "Bootloader status",
      "prefix": "STATUS_",
      "kind": "value",
      "values": [
        {
          "value": 1,
          "name": "LISTENING",
          "title": "Listening"
        },
        {
          "value": 2,
          "name": "ERASING",
          "title": "Erasing backup slot"
        },
        {
          "value": 3,
          "name": "RECEIVING",
          "title": "Receiving firmware data"
        },
        {
          "value": 6,
          "name": "VERIFYING",
          "title": "Verifying (size/CRC32/HMAC/HardwareID)"
        },
        {
          "value": 7,
          "name": "COPYING",
          "title": "Copying backup into main slot"
        },
        {
          "value": 4,
          "name": "VERIFY_OK",
          "title": "Verify OK - jumping to new firmware"
        },
        {
          "value": 5,
          "name": "VERIFY_FAIL",
          "title": "Verify failed - main slot untouched"
        },
        {
          "value": 255,
          "name": "ERROR",
          "title": "Error"
        }
      ]
    },
    {
      "name": "verify_fail_reason",
      "title": "Verify-fail reason",
      "prefix": "VERIFY_FAIL_REASON_",
      "kind": "value",
      "values": [
        {
          "value": 1,
          "name": "INCOMPLETE",
          "title": "Incomplete transfer"
        },
        {
          "value": 2,
          "name": "CRC32",
          "title": "CRC32 mismatch"
        },
        {
          "value": 3,
          "name": "HMAC",
          "title": "HMAC signature mismatch"
        },
        {
          "value": 4,
          "name": "HARDWARE_ID",
          "title": "HardwareID mismatch"
        },
        {
          "value": 5,
          "name": "ROLLBACK",
          "title": "Rollback rejected"
        }
      ]
    },
    {
      "name": "responder",
      "title": "Answering side",
      "prefix": "RESPONDER_",
      "kind": "value",
      "values": [
        {
          "value": 0,
          "name": "APPLICATION",
          "title": "The running application"
        },
        {
          "value": 1,
          "name": "BOOTLOADER",
          "title": "The bootloader"
        }
      ]
    },
    {
      "name": "thermal_fault",
      "title": "Thermal fault code",
      "prefix": "THERMAL_FAULT_",
      "kind": "value",
      "values": [